{
  "schema_version": 1,
  "environment": "production",
  "status": "draft",
  "source_repository": "appolon1908-hue/klyrow-Website-",
  "intent_commit": "0000000000000000000000000000000000000000",
  "release_sha": "0000000000000000000000000000000000000000",
  "image": "ghcr.io/appolon1908-hue/klyrow-website@sha256:0000000000000000000000000000000000000000000000000000000000000000",
  "sbom_sha256": "0000000000000000000000000000000000000000000000000000000000000000",
  "runtime_paths_sha256": "0000000000000000000000000000000000000000000000000000000000000000",
  "reviewed_pull_requests": [
    { "number": 4, "head_sha": "0000000000000000000000000000000000000000", "approved": true },
    { "number": 5, "head_sha": "0000000000000000000000000000000000000000", "approved": true },
    { "number": 6, "head_sha": "0000000000000000000000000000000000000000", "approved": true },
    { "number": 7, "head_sha": "0000000000000000000000000000000000000000", "approved": true },
    { "number": 8, "head_sha": "0000000000000000000000000000000000000000", "approved": true },
    { "number": 18, "head_sha": "0000000000000000000000000000000000000000", "approved": true },
    { "number": 9, "head_sha": "0000000000000000000000000000000000000000", "approved": true },
    { "number": 10, "head_sha": "0000000000000000000000000000000000000000", "approved": true },
    { "number": 11, "head_sha": "0000000000000000000000000000000000000000", "approved": true },
    { "number": 12, "head_sha": "0000000000000000000000000000000000000000", "approved": true },
    { "number": 13, "head_sha": "0000000000000000000000000000000000000000", "approved": true },
    { "number": 14, "head_sha": "0000000000000000000000000000000000000000", "approved": true },
    { "number": 19, "head_sha": "0000000000000000000000000000000000000000", "approved": true },
    { "number": 16, "head_sha": "0000000000000000000000000000000000000000", "approved": true }
  ],
  "staging_evidence_sha256": "0000000000000000000000000000000000000000000000000000000000000000",
  "rollback_evidence_sha256": "0000000000000000000000000000000000000000000000000000000000000000",
  "legal_release_state": "approved_exception",
  "created_at": "2026-08-26T00:00:00Z",
  "created_by": "replace-with-approved-operator",
  "change_id": null,
  "notes": "Example only. Copy to release-intent.json in a reviewed PR and replace every placeholder with exact evidence."
}
